{
  "schema": "pdgedit/v1",
  "assemblies": [
    {
      "id": "unit_lane1_2h_left.row.1",
      "type": "pro-noether-core-assembly",
      "x": 2,
      "y": 0,
      "title": "Pro Noether Core",
      "role": "reactant",
      "tiles": [
        "pro-noether-core",
        "binary-bare-br-none",
        "binary-bare-br-none",
        "binary-bare-br-none"
      ]
    },
    {
      "id": "unit_lane1_2h_left.row.2",
      "type": "anti-noether-core-assembly",
      "x": 2,
      "y": 1,
      "title": "Anti Noether Core",
      "role": "reactant",
      "tiles": [
        "anti-noether-core",
        "binary-bare-rb-none",
        "binary-bare-rb-none",
        "binary-bare-rb-none"
      ]
    },
    {
      "id": "unit_lane1_4h_left.row.1",
      "type": "pro-noether-core-assembly",
      "x": 2,
      "y": 2,
      "title": "Pro Noether Core",
      "role": "reactant",
      "tiles": [
        "pro-noether-core",
        "binary-bare-br-none",
        "binary-bare-br-none",
        "binary-bare-br-none"
      ]
    },
    {
      "id": "unit_lane1_4h_left.row.2",
      "type": "anti-noether-core-assembly",
      "x": 2,
      "y": 3,
      "title": "Anti Noether Core",
      "role": "reactant",
      "tiles": [
        "anti-noether-core",
        "binary-bare-rb-none",
        "binary-bare-rb-none",
        "binary-bare-rb-none"
      ]
    },
    {
      "id": "unit_lane1_4h_left.row.3",
      "type": "pro-noether-core-assembly",
      "x": 2,
      "y": 4,
      "title": "Pro Noether Core",
      "role": "reactant",
      "tiles": [
        "pro-noether-core",
        "binary-bare-br-none",
        "binary-bare-br-none",
        "binary-bare-br-none"
      ]
    },
    {
      "id": "unit_lane1_4h_left.row.4",
      "type": "anti-noether-core-assembly",
      "x": 2,
      "y": 5,
      "title": "Anti Noether Core",
      "role": "reactant",
      "tiles": [
        "anti-noether-core",
        "binary-bare-rb-none",
        "binary-bare-rb-none",
        "binary-bare-rb-none"
      ]
    },
    {
      "id": "unit_lane5_2h_right.row.1",
      "type": "pro-noether-core-assembly",
      "x": 16,
      "y": 0,
      "title": "Pro Noether Core",
      "role": "product",
      "tiles": [
        "pro-noether-core",
        "binary-bare-br-none",
        "binary-bare-br-none",
        "binary-bare-br-none"
      ]
    },
    {
      "id": "unit_lane5_2h_right.row.2",
      "type": "anti-noether-core-assembly",
      "x": 16,
      "y": 1,
      "title": "Anti Noether Core",
      "role": "product",
      "tiles": [
        "anti-noether-core",
        "binary-bare-rb-none",
        "binary-bare-rb-none",
        "binary-bare-rb-none"
      ]
    },
    {
      "id": "unit_lane5_4h_right.row.1",
      "type": "pro-noether-core-assembly",
      "x": 16,
      "y": 2,
      "title": "Pro Noether Core",
      "role": "product",
      "tiles": [
        "pro-noether-core",
        "binary-bare-br-none",
        "binary-bare-br-none",
        "binary-bare-br-none"
      ]
    },
    {
      "id": "unit_lane5_4h_right.row.2",
      "type": "anti-noether-core-assembly",
      "x": 16,
      "y": 3,
      "title": "Anti Noether Core",
      "role": "product",
      "tiles": [
        "anti-noether-core",
        "binary-bare-rb-none",
        "binary-bare-rb-none",
        "binary-bare-rb-none"
      ]
    },
    {
      "id": "unit_lane5_4h_right.row.3",
      "type": "pro-noether-core-assembly",
      "x": 16,
      "y": 4,
      "title": "Pro Noether Core",
      "role": "product",
      "tiles": [
        "pro-noether-core",
        "binary-bare-br-none",
        "binary-bare-br-none",
        "binary-bare-br-none"
      ]
    },
    {
      "id": "unit_lane5_4h_right.row.4",
      "type": "anti-noether-core-assembly",
      "x": 16,
      "y": 5,
      "title": "Anti Noether Core",
      "role": "product",
      "tiles": [
        "anti-noether-core",
        "binary-bare-rb-none",
        "binary-bare-rb-none",
        "binary-bare-rb-none"
      ]
    }
  ],
  "operators": [],
  "links": [],
  "compositeLabels": []
}
